<?xml version="1.0" encoding="UTF-8"?>
<!DOCTYPE TABLES SYSTEM "table2.dtd">
<!-- 
    Warning : The Column name must match the name of the field in the java classes

-->
<TABLES>
    <TABLE name="Portfolio">
        <COLUMN name="idPortfolio" type="Long" length="10" nullable="false" autoincrement="true" />
        <COLUMN name="isFake" type="String" length="1" nullable="false" autoincrement="false" />
        <COLUMN name="name" type="String" length="45" nullable="false" autoincrement="false" />
        <PRIMARYKEY>
            <KEYITEM component="idPortfolio"/>
        </PRIMARYKEY>
    </TABLE>
    <TABLE name="ShareQuantity">
        <COLUMN name="idShareQuantity" type="Long" length="10" nullable="false" autoincrement="true" />
        <COLUMN name="changeFee" type="java.math.BigDecimal" length="12" nullable="false" autoincrement="false" />
        <COLUMN name="changeQuantity" type="java.math.BigDecimal" length="12" nullable="false" autoincrement="false" />
        <COLUMN name="changeType" type="String" length="1" nullable="false" autoincrement="false" />
        <COLUMN name="changeValue" type="java.math.BigDecimal" length="12" nullable="false" autoincrement="false" />
        <COLUMN name="description" type="String" length="1000" nullable="true" autoincrement="false" />
        <COLUMN name="idShare" type="Long" length="10" nullable="false" autoincrement="false" />
        <COLUMN name="valueDate" type="java.util.Date" length="10" nullable="false" autoincrement="false" />
        <PRIMARYKEY>
            <KEYITEM component="idShareQuantity"/>
        </PRIMARYKEY>
    </TABLE>
    <TABLE name="Share">
        <COLUMN name="idShare" type="Long" length="10" nullable="false" autoincrement="true" />
        <COLUMN name="codeISIN" type="String" length="45" nullable="true" autoincrement="false" />
        <COLUMN name="codeYahoo" type="String" length="45" nullable="true" autoincrement="false" />
        <COLUMN name="description" type="String" length="4000" nullable="true" autoincrement="false" />
        <COLUMN name="idPortfolio" type="Long" length="10" nullable="false" autoincrement="false" />
        <COLUMN name="name" type="String" length="255" nullable="false" autoincrement="false" />
        <PRIMARYKEY>
            <KEYITEM component="idShare"/>
        </PRIMARYKEY>
    </TABLE>
    <TABLE name="ShareValue">
        <COLUMN name="idShareValue" type="Long" length="10" nullable="false" autoincrement="true" />
        <COLUMN name="isShare" type="Long" length="10" nullable="false" autoincrement="false" />
        <COLUMN name="value" type="java.math.BigDecimal" length="10" nullable="false" autoincrement="false" />
        <COLUMN name="valueDate" type="java.util.Date" length="10" nullable="false" autoincrement="false" />
        <PRIMARYKEY>
            <KEYITEM component="idShareValue"/>
        </PRIMARYKEY>
    </TABLE>
</TABLES>
